{
  "$schema": "https://raw.githubusercontent.com/Pom4H/open-device/main/packages/spec/schemas/open-device-package.schema.json",
  "manifestVersion": "0.1",
  "id": "https://devices.open-device.dev/reference/process-header",
  "version": "0.1.0",
  "kind": "plant-model",
  "name": "process-header",
  "title": "Water process header",
  "description": "Reusable four-branch water manifold for composed engineering topology examples.",
  "vendor": {
    "name": "Open Device Reference",
    "url": "https://devices.open-device.dev"
  },
  "license": "Apache-2.0",
  "model": {
    "href": "./model/device-model.json",
    "mediaType": "application/json"
  }
}
