{
  "$schema": "https://raw.githubusercontent.com/Pom4H/open-device/main/packages/spec/schemas/open-device-package.schema.json",
  "manifestVersion": "0.1",
  "id": "https://devices.example.com/pump-controller",
  "version": "1.0.0",
  "kind": "physical-device",
  "name": "pump-controller",
  "title": "Pump controller",
  "description": "Pressure-controlled pump controller with safety interlocks",
  "vendor": {
    "name": "Example Devices",
    "url": "https://devices.example.com"
  },
  "license": "Apache-2.0",
  "model": {
    "href": "./model/device-model.json",
    "mediaType": "application/json"
  }
}
