{
  "$schema": "https://raw.githubusercontent.com/Pom4H/open-device/main/packages/spec/schemas/open-device-package.schema.json",
  "manifestVersion": "0.1",
  "id": "https://devices.open-device.dev/reference/pressure-transmitter",
  "version": "0.1.0",
  "kind": "physical-device",
  "name": "pressure-transmitter",
  "title": "Pressure transmitter 4–20 mA",
  "description": "Reference pressure transmitter for engineering topology examples.",
  "vendor": {
    "name": "Open Device Reference",
    "url": "https://devices.open-device.dev"
  },
  "license": "Apache-2.0",
  "model": {
    "href": "./model/device-model.json",
    "mediaType": "application/json"
  }
}
